{
  "schema_version": "1.0.0",
  "note_id": "valid-with-1-item-list",
  "title": "List with 1 item",
  "layer": "l2",
  "blocks": [
    {
      "node": "section",
      "attrs": {"level": 1, "capability": "section-h1"},
      "source_refs": [],
      "children": [
        {
          "node": "list",
          "attrs": {"ordered": false, "capability": "list"},
          "source_refs": [],
          "children": [
            {
              "node": "text",
              "attrs": {"text": "Solo item.", "capability": "text"},
              "source_refs": []
            }
          ]
        }
      ]
    }
  ]
}
